{
  "schema": "madb.candidate/1",
  "candidate_digest": "sha256:15abceb4f71f4a0d39aa808b3f4521ed46b0720442e37cabd8a1b4b8959375db",
  "selector": {
    "route": "RUST-C-ABI",
    "profile_id": "rust-c-fixture",
    "profile_digest": "sha256:70dde7881610c582d49ef26a53cf3e82929622adcf112eb1ab79cc70dd65cfb8",
    "target": "aarch64-apple-darwin",
    "direction": "consumer-to-provider"
  },
  "generation_id": "sha256:1b70ad72ef6218f68ce034a05b2347233856f3ae391b61e40e85073b79e4a772",
  "contract_digest": "sha256:467501ee75d0be2236f4f9986fb08ce4a8fb1b2c15e454ea62dd8914fe513f71",
  "policy_digest": "sha256:0718f74ee75a9182bf6a08c170b97313654d5c078971d17093b164a436ab9932",
  "lock_digest": "sha256:f16d05ec6b29248d2c61adb1e9263f78e4f7bace1b955014a2d17872cfe4064d",
  "manifest_path": "candidate.json",
  "files": [
    {
      "path": "include/fixture.h",
      "sha256": "sha256:4bb22b0ee90063902f311729b64e89429a488ece5eb14a0423a6768177f535aa",
      "size": 21
    }
  ],
  "dependencies": [],
  "public_symbols": [
    "fixture.await_closed.v1",
    "fixture.checksum.v1",
    "fixture.create.v1",
    "fixture.release_handle.v1",
    "fixture.request_close.v1"
  ],
  "required_cases": [
    "DATA-001/positive/rust-c"
  ],
  "build_evidence": [
    {
      "path": "evidence/build.json",
      "sha256": "sha256:f16d05ec6b29248d2c61adb1e9263f78e4f7bace1b955014a2d17872cfe4064d",
      "size": 7,
      "schema": "madb.build-evidence/1"
    }
  ]
}
